COMMENT;#.*;"Comments in Python.";#808080
SYMBOL;[\s\(\):,{}.];"Spaces, tabs, newlines, parentheses and colon.";#7F7F7F
KEYWORD;\b(and|as|assert|break|class|continue|def|del|elif|else|except|finally|for|from|global|if|import|in|is|lambda|nonlocal|not|or|pass|raise|return|try|while|with|yield)\b;"Reserved keywords in Python.";#1066C4FF
FUNCTION;[a-zA-Z_][a-zA-Z_0-9]*\(;"Calls to functions.";#4C4C76FF
IDENTIFIER;[a-zA-Z_][a-zA-Z_0-9]*;"Names for variables and functions.";#008000
NUMBER;\b\d+(\.\d+)?\b;"Integer and floating-point numbers.";#FF6347
STRING;(\"(\\.|[^"\\])*\"|'(\\.|[^'\\])*');"String literals.";#8B008B
OPERATOR;[\+\-\*/%<>!=]=?|==|!=|//|<<|>>|&|\||\^|~;"Arithmetic and logical operators.";#FFA500
ASSIGNMENT;=;"Assignment operators.";#800080